<?xml version="1.0" encoding="UTF-8"?>
<inst:InstitutionalRecord xmlns:inst="http://institution.example.org/master"
                          xmlns:xsi="http://www.w3.org/2001/XMLSchema-instance"
                          xsi:schemaLocation="http://institution.example.org/master ../schemas/institutional-master.xsd"
                          version="1.0"
                          recordId="SRC-12345">
    <inst:Metadata>
        <inst:CreatedDate>2026-01-14T10:00:00Z</inst:CreatedDate>
        <inst:ModifiedDate>2026-01-14T12:30:00Z</inst:ModifiedDate>
        <inst:Source>Legacy System v2.1</inst:Source>
        <inst:TransformationRef>source-to-institutional.xsl</inst:TransformationRef>
    </inst:Metadata>
    <inst:Entity>
        <inst:Identifier type="institutional" sourceId="ITEM-ABC-789">SRC-12345</inst:Identifier>
        <inst:Name sourceName="Sample Document Title">Sample Document Title</inst:Name>
        <inst:Description>This is a detailed description of the sample document from the legacy system.</inst:Description>
        <inst:Attributes>
            <inst:Attribute name="category" sourceField="category">Research</inst:Attribute>
            <inst:Attribute name="status" sourceField="status">Active</inst:Attribute>
            <inst:Attribute name="priority" sourceField="priority">High</inst:Attribute>
        </inst:Attributes>
    </inst:Entity>
    <inst:Traceability>
        <inst:SourceMapping institutionalElement="InstitutionalRecord/@recordId" 
                           sourceElement="SourceRecord/@id" 
                           transformationRule="direct-copy"/>
        <inst:SourceMapping institutionalElement="Metadata/CreatedDate" 
                           sourceElement="RecordInfo/Created" 
                           transformationRule="direct-copy"/>
        <inst:SourceMapping institutionalElement="Metadata/ModifiedDate" 
                           sourceElement="RecordInfo/Updated" 
                           transformationRule="direct-copy"/>
        <inst:SourceMapping institutionalElement="Metadata/Source" 
                           sourceElement="RecordInfo/Origin" 
                           transformationRule="direct-copy"/>
        <inst:SourceMapping institutionalElement="Entity/Identifier" 
                           sourceElement="SourceRecord/@id" 
                           transformationRule="direct-copy"/>
        <inst:SourceMapping institutionalElement="Entity/Identifier/@sourceId" 
                           sourceElement="Item/ItemId" 
                           transformationRule="direct-copy"/>
        <inst:SourceMapping institutionalElement="Entity/Name" 
                           sourceElement="Item/Title" 
                           transformationRule="direct-copy"/>
        <inst:SourceMapping institutionalElement="Entity/Description" 
                           sourceElement="Item/Details" 
                           transformationRule="direct-copy"/>
        <inst:SourceMapping institutionalElement="Entity/Attributes/Attribute" 
                           sourceElement="Item/Properties/Property" 
                           transformationRule="key-to-name-mapping"/>
    </inst:Traceability>
</inst:InstitutionalRecord>
